{
  "did": "did:key:z6MkpTHR8VNsBxYAAWHut2Geadd9jSwuBV8xRoAnwWsdvktH",
  "version": 5,
  "verifications": [
    "eyJhbGciOiJFZERTQSIsImtpZCI6ImRpZDprZXk6ejZNa28zWkVqS0pXUUFNNW5EWEtvWjlqRXJ2dnhiV2JZZ1M4S0pYWXBDNUhidThhI3NpZy0wIiwidHlwIjoidmMrand0In0.eyJAY29udGV4dCI6WyJodHRwczovL3d3dy53My5vcmcvbnMvY3JlZGVudGlhbHMvdjIiXSwidHlwZSI6WyJWZXJpZmlhYmxlQ3JlZGVudGlhbCIsIldvdEF0dGVzdGF0aW9uIiwiV290VmVyaWZpY2F0aW9uIl19.tuVMtbFqSgss7EismlbJuN-y8P0DbbJyMbP3H_GZfNvFIvYL826FwS3gynYuGzGuMNrpkfKG7jsC2mG38IHlBg"
  ],
  "updatedAt": "2026-04-22T10:00:00Z"
}
